{
  "$schema": "../../schema/case.schema.json",
  "schema_version": "1.0",
  "case_id": "H01",
  "title": "Web IM message content interactions",
  "stratum": "historical_regression",
  "status": "draft",
  "origin": {
    "kind": "historical_unit",
    "reference": "feat-484-chat-message-interactions",
    "cutoff_policy": "before_first_target_trace"
  },
  "brief_ref": "public/brief.md",
  "artifact_contract": "single_unit",
  "terminal_mode": "gate2_complete",
  "source_root_ids": [
    "nano-h01-088b2f8b"
  ],
  "clocks": {
    "product": {
      "mode": "historical_pre_target",
      "ref": "audit/provenance.md#product-clock"
    },
    "knowledge": {
      "mode": "historical_cutoff",
      "ref": "audit/provenance.md#knowledge-clock"
    },
    "documentation": {
      "mode": "suite_frozen_latest",
      "ref": "audit/provenance.md#documentation-clock"
    },
    "workflow": {
      "mode": "current_frozen",
      "ref": "audit/provenance.md#workflow-clock"
    },
    "user": {
      "mode": "current_cross_fitted",
      "ref": "audit/provenance.md#user-clock"
    },
    "model_tool": {
      "mode": "current_frozen",
      "ref": "audit/provenance.md#modeltool-clock"
    }
  },
  "layers": {
    "product_world": {
      "manifest_ref": "runtime/H01/manifests/product-world.json",
      "sha256": "pending"
    },
    "documentation_world": {
      "manifest_ref": "runtime/H01/manifests/documentation-world.json",
      "sha256": "pending"
    },
    "common_compatibility": {
      "manifest_ref": "runtime/H01/manifests/common-compatibility.json",
      "sha256": "pending"
    },
    "arm_bundle": {
      "manifest_ref": "runtime/H01/manifests/treatment.json",
      "sha256": "pending"
    },
    "private_controls": "judge-private"
  },
  "owner_answer_policy": {
    "manifest_ref": "runtime/H01/private/owner-answer-policy.json",
    "sha256": "pending"
  },
  "arms": {
    "A": {
      "workflow": "current_spec_design_skills",
      "user_profile": "none",
      "bundle_ref": "runtime/H01/manifests/treatment.json#/arms/A"
    },
    "A_USER": {
      "workflow": "current_spec_design_skills",
      "user_profile": "current_cross_fitted",
      "bundle_ref": "runtime/H01/manifests/treatment.json#/arms/A_USER"
    },
    "B": {
      "workflow": "spec_design_agent_team",
      "user_profile": "current_cross_fitted",
      "bundle_ref": "runtime/H01/manifests/treatment.json#/arms/B"
    }
  },
  "normalization": {
    "level": "N0",
    "task_blind": true,
    "authority_map_ref": "knowledge/authority-map.json"
  },
  "contamination": {
    "level": "C1",
    "lineage_ref": "audit/provenance.md#lineage-audit",
    "oracle_lineage": "historical_target_derived_private",
    "notes": "Historical regression only. Current workflow rules may contain generic lessons from the same development era; target-derived current contracts and profile evidence are excluded from candidate input."
  },
  "treatment_authoring": {
    "status": "historical_posthoc",
    "clean_holdout_eligible": false,
    "evidence_ref": "audit/provenance.md#lineage-audit"
  },
  "sensitivity": {
    "raw_vs_dp1": true
  },
  "contract_assets": {
    "case": "case.json",
    "brief": "public/brief.md",
    "authority_map": "knowledge/authority-map.json",
    "decision_inventory": "judge-private/decision-inventory.json",
    "rubric": "judge-private/rubric.md",
    "provenance": "audit/provenance.md",
    "leak_signatures": "audit/leak-signatures.txt"
  },
  "restrictions": {
    "network": false,
    "real_push": false,
    "host_memory": false,
    "parent_repo_access": false,
    "candidate_export_excludes": [
      "case.json",
      "knowledge",
      "judge-private",
      "audit"
    ]
  },
  "notes": "Transitional historical layout. N0 adds only current path aliases to unchanged cutoff authorities; no answer-bearing summaries are allowed."
}
